{
  "path": "examples/designspace-ufo/masters/VariationDemo-Regular.ufo",
  "formatVersion": 3,
  "glyphCount": 5,
  "glyphs": [
    {
      "name": ".notdef",
      "layer": "public.default",
      "file": "examples/designspace-ufo/masters/VariationDemo-Regular.ufo/glyphs/notdef.glif",
      "width": 600.0,
      "components": [],
      "anchors": [],
      "variableComponents": [],
      "glyphDesignspace": null
    },
    {
      "name": "stem",
      "layer": "public.default",
      "file": "examples/designspace-ufo/masters/VariationDemo-Regular.ufo/glyphs/stem.glif",
      "width": 600.0,
      "components": [],
      "anchors": [
        {
          "name": "top",
          "x": 150.0,
          "y": 700.0,
          "identifier": null
        }
      ],
      "variableComponents": [],
      "glyphDesignspace": null
    },
    {
      "name": "acute",
      "layer": "public.default",
      "file": "examples/designspace-ufo/masters/VariationDemo-Regular.ufo/glyphs/acute.glif",
      "width": 600.0,
      "components": [],
      "anchors": [
        {
          "name": "_top",
          "x": 90.0,
          "y": 0.0,
          "identifier": null
        }
      ],
      "variableComponents": [],
      "glyphDesignspace": null
    },
    {
      "name": "composite",
      "layer": "public.default",
      "file": "examples/designspace-ufo/masters/VariationDemo-Regular.ufo/glyphs/composite.glif",
      "width": 600.0,
      "components": [
        {
          "base": "stem",
          "transform": {
            "xScale": 1.0,
            "xyScale": 0.0,
            "yxScale": 0.0,
            "yScale": 1.0,
            "xOffset": 30.0,
            "yOffset": 0.0
          },
          "identifier": null
        },
        {
          "base": "acute",
          "transform": {
            "xScale": 1.0,
            "xyScale": 0.0,
            "yxScale": 0.0,
            "yScale": 1.0,
            "xOffset": 210.0,
            "yOffset": 700.0
          },
          "identifier": null
        }
      ],
      "anchors": [],
      "variableComponents": [],
      "glyphDesignspace": null
    },
    {
      "name": "varComposite",
      "layer": "public.default",
      "file": "examples/designspace-ufo/masters/VariationDemo-Regular.ufo/glyphs/varComposite.glif",
      "width": 600.0,
      "components": [],
      "anchors": [],
      "variableComponents": [
        {
          "base": "stem",
          "location": {
            "Weight": 700,
            "Width": 75
          },
          "transformation": {
            "translateX": 40,
            "translateY": 0,
            "rotation": 0.0,
            "scaleX": 1.0,
            "scaleY": 1.0
          }
        }
      ],
      "glyphDesignspace": null
    }
  ]
}
